{
  "$schema": "https://json-schema.org/draft/2020-12/schema",
  "$id": "https://mccqe-qbank.invalid/schemas/reference.schema.json",
  "title": "Canonical clinical reference",
  "$defs": {
    "support": {
      "type": "object",
      "additionalProperties": false,
      "required": ["claim", "locator"],
      "properties": {
        "claim": {"type": "string", "minLength": 1, "pattern": "\\S"},
        "locator": {"type": "string", "minLength": 1, "pattern": "\\S"}
      }
    }
  },
  "type": "object",
  "additionalProperties": false,
  "required": ["reference_id", "title", "organization", "url", "publication_or_update_date", "accessed_date", "source_tier", "supports"],
  "properties": {
    "reference_id": {"type": "string", "pattern": "^REF-[A-Z0-9]+(?:-[A-Z0-9]+)*$"},
    "title": {"type": "string", "minLength": 1, "pattern": "\\S"},
    "organization": {"type": "string", "minLength": 1, "pattern": "\\S"},
    "url": {"type": "string", "format": "uri", "pattern": "^https://"},
    "publication_or_update_date": {"type": "string", "format": "date"},
    "accessed_date": {"type": "string", "format": "date"},
    "source_tier": {"type": "integer", "minimum": 1, "maximum": 4},
    "supports": {"type": "array", "minItems": 1, "uniqueItems": true, "items": {"$ref": "#/$defs/support"}}
  }
}
