{
  "accessed_date": "2026-08-23",
  "organization": "Synthetic Standards Organization",
  "publication_or_update_date": "2026-01-15",
  "reference_id": "REF-SYN-001",
  "source_tier": 1,
  "supports": [
    {
      "claim": "The synthetic rule supports option A.",
      "locator": "Synthetic recommendation 1"
    }
  ],
  "title": "Synthetic Practice Standard",
  "url": "https://example.invalid/synthetic-standard"
}
